Campaign_Id,Campaign_Name,Category,Launch_Date,Sub_Category,Campaign_Drivers,Product_Id,Call_For_Action,Focused_Geography,Tenure_Of_Campaign
1,Above all in service,Acquisition,01/01/14,Branding,Discount offer,3,1,Nation Wide,1
2,All your protection under one roof,Acquisition,03/21/14,Seasonal,Extra benefits,1,1,Nation Wide,1
3,Be life full confident,Acquisition,05/25/14,Branding,Additional Coverage,2,1,Nation Wide,1
4,Together we are stronger,Acquisition,07/01/14,Penetration,Extra benefits,5,0,Nation Wide,1
5,The power to help you succeed,Acquisition,09/27/14,Penetration,Extra benefits,4,0,Nation Wide,2
6,Know Money,Acquisition,12/05/14,Penetration,Extra benefits,6,1,Nation Wide,2
